{
  "version": 1,
  "defaultPolicy": "disabled",
  "triggerButton": "right",
  "pen": {
    "enabled": true,
    "color": "#1f7fff",
    "opacity": 0.8,
    "thickness": 5
  },
  "scriptThreadCount": 8,
  "scriptTimeoutSeconds": 0,
  "namespaces": [
    "System",
    "System.Collections",
    "System.Collections.Concurrent",
    "System.Collections.Generic",
    "System.Collections.ObjectModel",
    "System.Collections.Specialized",
    "System.Diagnostics",
    "System.Drawing",
    "System.Drawing.Imaging",
    "System.Drawing.Text",
    "System.IO",
    "System.IO.Compression",
    "System.IO.Pipes",
    "System.IO.Ports",
    "System.Linq",
    "System.Linq.Expressions",
    "System.Media",
    "System.Net",
    "System.Net.Http",
    "System.Net.Http.Headers",
    "System.Net.Security",
    "System.Net.Sockets",
    "System.Reflection",
    "System.Security",
    "System.Security.Authentication",
    "System.Security.Cryptography",
    "System.Text",
    "System.Text.RegularExpressions",
    "System.Threading",
    "System.Threading.Tasks",
    "System.Timers",
    "System.Web",
    "System.Windows.Forms",
    "System.Xml",
    "System.Xml.Linq",
    "System.Xml.Schema",
    "System.Xml.Serialization"
  ],
  "assemblies": [
    "System.dll",
    "System.Core.dll",
    "System.Drawing.dll",
    "System.Net.Http.dll",
    "System.Web.dll",
    "System.Windows.Forms.dll",
    "System.Xml.dll",
    "System.Xml.Linq.dll"
  ],
  "filters": [
    "mstsc\\.exe",
    "WindowsSandboxClient\\.exe",
    "VirtualBoxVM\\.exe"
  ],
  "gestures": [
    {
      "id": "up",
      "name": "↑",
      "points": [
        {
          "x": 0,
          "y": 0
        },
        {
          "x": 0,
          "y": -100
        }
      ],
      "vectors": [
        [
          0,
          -127
        ],
        [
          0,
          -127
        ],
        [
          0,
          -127
        ],
        [
          0,
          -127
        ],
        [
          0,
          -127
        ],
        [
          0,
          -127
        ],
        [
          0,
          -127
        ],
        [
          0,
          -127
        ],
        [
          0,
          -127
        ],
        [
          0,
          -127
        ],
        [
          0,
          -127
        ],
        [
          0,
          -127
        ],
        [
          0,
          -127
        ],
        [
          0,
          -127
        ],
        [
          0,
          -127
        ],
        [
          0,
          -127
        ],
        [
          0,
          -127
        ],
        [
          0,
          -127
        ],
        [
          0,
          -127
        ],
        [
          0,
          -127
        ],
        [
          0,
          -127
        ],
        [
          0,
          -127
        ],
        [
          0,
          -127
        ],
        [
          0,
          -127
        ],
        [
          0,
          -127
        ],
        [
          0,
          -127
        ],
        [
          0,
          -127
        ],
        [
          0,
          -127
        ],
        [
          0,
          -127
        ],
        [
          0,
          -127
        ],
        [
          0,
          -127
        ],
        [
          0,
          -127
        ],
        [
          0,
          -127
        ],
        [
          0,
          -127
        ],
        [
          0,
          -127
        ],
        [
          0,
          -127
        ],
        [
          0,
          -127
        ],
        [
          0,
          -127
        ],
        [
          0,
          -127
        ],
        [
          0,
          -127
        ],
        [
          0,
          -127
        ],
        [
          0,
          -127
        ],
        [
          0,
          -127
        ],
        [
          0,
          -127
        ],
        [
          0,
          -127
        ],
        [
          0,
          -127
        ],
        [
          0,
          -127
        ],
        [
          0,
          -127
        ],
        [
          0,
          -127
        ],
        [
          0,
          -127
        ],
        [
          0,
          -127
        ],
        [
          0,
          -127
        ],
        [
          0,
          -127
        ],
        [
          0,
          -127
        ],
        [
          0,
          -127
        ],
        [
          0,
          -127
        ],
        [
          0,
          -127
        ],
        [
          0,
          -127
        ],
        [
          0,
          -127
        ],
        [
          0,
          -127
        ],
        [
          0,
          -127
        ],
        [
          0,
          -127
        ],
        [
          0,
          -127
        ],
        [
          0,
          -127
        ],
        [
          0,
          -127
        ],
        [
          0,
          -127
        ],
        [
          0,
          -127
        ],
        [
          0,
          -127
        ],
        [
          0,
          -127
        ],
        [
          0,
          -127
        ],
        [
          0,
          -127
        ],
        [
          0,
          -127
        ],
        [
          0,
          -127
        ],
        [
          0,
          -127
        ],
        [
          0,
          -127
        ],
        [
          0,
          -127
        ],
        [
          0,
          -127
        ],
        [
          0,
          -127
        ],
        [
          0,
          -127
        ],
        [
          0,
          -127
        ],
        [
          0,
          -127
        ],
        [
          0,
          -127
        ],
        [
          0,
          -127
        ],
        [
          0,
          -127
        ],
        [
          0,
          -127
        ],
        [
          0,
          -127
        ],
        [
          0,
          -127
        ],
        [
          0,
          -127
        ],
        [
          0,
          -127
        ],
        [
          0,
          -127
        ],
        [
          0,
          -127
        ],
        [
          0,
          -127
        ],
        [
          0,
          -127
        ],
        [
          0,
          -127
        ],
        [
          0,
          -127
        ],
        [
          0,
          -127
        ],
        [
          0,
          -127
        ],
        [
          0,
          -127
        ],
        [
          0,
          -127
        ],
        [
          0,
          -127
        ],
        [
          0,
          -127
        ],
        [
          0,
          -127
        ],
        [
          0,
          -127
        ],
        [
          0,
          -127
        ],
        [
          0,
          -127
        ],
        [
          0,
          -127
        ],
        [
          0,
          -127
        ],
        [
          0,
          -127
        ],
        [
          0,
          -127
        ],
        [
          0,
          -127
        ],
        [
          0,
          -127
        ],
        [
          0,
          -127
        ],
        [
          0,
          -127
        ],
        [
          0,
          -127
        ],
        [
          0,
          -127
        ],
        [
          0,
          -127
        ],
        [
          0,
          -127
        ],
        [
          0,
          -127
        ],
        [
          0,
          -127
        ],
        [
          0,
          -127
        ],
        [
          0,
          -127
        ],
        [
          0,
          -127
        ],
        [
          0,
          -127
        ],
        [
          0,
          -127
        ],
        [
          0,
          -127
        ],
        [
          0,
          -127
        ],
        [
          0,
          -127
        ],
        [
          0,
          -127
        ]
      ]
    },
    {
      "id": "down",
      "name": "↓",
      "points": [
        {
          "x": 0,
          "y": 0
        },
        {
          "x": 0,
          "y": 100
        }
      ],
      "vectors": [
        [
          0,
          127
        ],
        [
          0,
          127
        ],
        [
          0,
          127
        ],
        [
          0,
          127
        ],
        [
          0,
          127
        ],
        [
          0,
          127
        ],
        [
          0,
          127
        ],
        [
          0,
          127
        ],
        [
          0,
          127
        ],
        [
          0,
          127
        ],
        [
          0,
          127
        ],
        [
          0,
          127
        ],
        [
          0,
          127
        ],
        [
          0,
          127
        ],
        [
          0,
          127
        ],
        [
          0,
          127
        ],
        [
          0,
          127
        ],
        [
          0,
          127
        ],
        [
          0,
          127
        ],
        [
          0,
          127
        ],
        [
          0,
          127
        ],
        [
          0,
          127
        ],
        [
          0,
          127
        ],
        [
          0,
          127
        ],
        [
          0,
          127
        ],
        [
          0,
          127
        ],
        [
          0,
          127
        ],
        [
          0,
          127
        ],
        [
          0,
          127
        ],
        [
          0,
          127
        ],
        [
          0,
          127
        ],
        [
          0,
          127
        ],
        [
          0,
          127
        ],
        [
          0,
          127
        ],
        [
          0,
          127
        ],
        [
          0,
          127
        ],
        [